{
  "osodVersion": "0.1",
  "recordId": "11111111-1111-4111-8111-111111111111",
  "recordType": "operationeleDuikregistratie",
  "conformanceClaims": [
    "S"
  ],
  "createdAt": "2026-06-08T12:00:00Z",
  "sourceSystem": {
    "name": "Voorbeeld",
    "version": "0.1",
    "exportedAt": "2026-06-08T12:00:00Z"
  },
  "context": {
    "veiligheidsregio": "VR Demo",
    "duikteam": "Team Demo",
    "locatie": {
      "omschrijving": "Oefenlocatie Demo"
    },
    "activiteitType": "oefening",
    "oefencode": "BRW-BWD.02",
    "omschrijving": "Fictieve oefenduik"
  },
  "roles": {
    "duikploegleider": {
      "displayName": "DPL 1",
      "localPersonId": "demo-dpl-1",
      "role": "duikploegleider",
      "scope": "A15"
    },
    "duikers": [
      {
        "displayName": "Duiker 1",
        "localPersonId": "demo-duiker-1",
        "role": "duiker",
        "scope": "A15",
        "isReserveduiker": false
      }
    ]
  },
  "dive": {
    "datum": "2026-06-08",
    "tijdIn": "10:00",
    "tijdUit": "10:18",
    "duiktijdMin": 18,
    "totaleTijdOnderDrukMin": 18,
    "maximaleDiepteWerkelijkM": 9.0,
    "tabelDiepteM": 9,
    "gevolgdSchema": {
      "schemaType": "DCIEM_AIR_TABLE",
      "naam": "DCIEM Airtabel 1",
      "bronId": "IWOD-002-2019-2300",
      "versie": "2019-04-01"
    },
    "decompressieverloop": {
      "type": "NO_DECO",
      "stops": [],
      "omschrijving": "Geen decompressiestop uitgevoerd."
    },
    "ademgas": "ademlucht",
    "duiksysteem": "SCUBA",
    "aardDuikarbeid": "oefening",
    "aantalDuikers": 1,
    "bijzondereSessies": []
  },
  "signoff": {
    "status": "concept",
    "duikploegleiderGetekend": false,
    "werkgeverOfOpdrachtgeverGetekend": false
  },
  "calculation": null,
  "incidentReference": {
    "hasIncidentRecord": false,
    "referenceId": null,
    "summary": null
  }
}
