{
  "osodVersion": "0.1",
  "recordId": "77777777-7777-4777-8777-777777777777",
  "recordType": "operationeleDuikregistratie",
  "conformanceClaims": [
    "S",
    "R"
  ],
  "createdAt": "2026-06-08T13:00:00Z",
  "sourceSystem": {
    "name": "Voorbeeld",
    "version": "0.1",
    "exportedAt": "2026-06-08T12:00:00Z"
  },
  "context": {
    "veiligheidsregio": "VR Demo",
    "duikteam": "Team Demo",
    "locatie": {
      "omschrijving": "Oefenlocatie Demo"
    },
    "activiteitType": "oefening",
    "oefencode": "BRW-BWD.02",
    "omschrijving": "Fictieve oefenduik"
  },
  "roles": {
    "duikploegleider": {
      "displayName": "DPL 1",
      "localPersonId": "demo-dpl-1",
      "role": "duikploegleider",
      "scope": "A15"
    },
    "duikers": [
      {
        "displayName": "Duiker 1",
        "localPersonId": "demo-duiker-1",
        "role": "duiker",
        "scope": "A15",
        "isReserveduiker": false
      }
    ]
  },
  "dive": {
    "datum": "2026-06-08",
    "tijdIn": "10:00",
    "tijdUit": "10:18",
    "duiktijdMin": 18,
    "totaleTijdOnderDrukMin": 18,
    "maximaleDiepteWerkelijkM": 16.4,
    "tabelDiepteM": null,
    "gevolgdSchema": {
      "schemaType": "DCIEM_AIR_TABLE",
      "naam": "DCIEM Airtabel 1",
      "bronId": "IWOD-002-2019-2300",
      "versie": "2019-04-01"
    },
    "decompressieverloop": {
      "type": "NO_DECO",
      "stops": [],
      "omschrijving": "Geen decompressiestop uitgevoerd."
    },
    "ademgas": "ademlucht",
    "duiksysteem": "SCUBA",
    "aardDuikarbeid": "oefening",
    "aantalDuikers": 1,
    "bijzondereSessies": [
      "Niet-geplande diepteoverschrijding; berekening geblokkeerd."
    ]
  },
  "signoff": {
    "status": "concept",
    "duikploegleiderGetekend": false,
    "werkgeverOfOpdrachtgeverGetekend": false
  },
  "calculation": {
    "status": "RED",
    "resultValid": false,
    "engine": {
      "name": "Demo DCIEM Engine",
      "version": "0.1",
      "tableSourceId": "IWOD-002-2019-2300",
      "tableFingerprintSha256": "75e1bf9654d4f025b63dca6a3303244c4563960450086731cc8ef08b47648bed"
    },
    "inputEnvelope": {
      "actualMaxDepthM": 16.4,
      "breathingGas": "ademlucht"
    },
    "outputs": {},
    "blockingReasons": [],
    "messages": [
      "Ongeldig voorbeeld: rode status zonder vastgelegde blokkeerreden."
    ]
  },
  "incidentReference": {
    "hasIncidentRecord": false,
    "referenceId": null,
    "summary": null
  }
}
